{
 "formatVersion": 1,
 "id": "developer.western-siberia-district",
 "name": "Western Siberia District",
 "license": "CC0-1.0",
 "projection": "isometric-diamond",
 "dimensions": {
  "width": 144,
  "height": 104
 },
 "cellSize": {
  "width": 80,
  "height": 40
 },
 "regions": [
  {
   "id": "ground-1a",
   "x": 0,
   "y": 0,
   "width": 144,
   "height": 92,
   "surface": "snow",
   "walkable": true,
   "elevation": 0,
   "color": "#9aa6ad"
  },
  {
   "id": "ground-1l",
   "x": 0,
   "y": 92,
   "width": 56,
   "height": 12,
   "surface": "snow",
   "walkable": true,
   "elevation": 0,
   "color": "#9aa6ad"
  },
  {
   "id": "ground-1r",
   "x": 90,
   "y": 92,
   "width": 54,
   "height": 12,
   "surface": "snow",
   "walkable": true,
   "elevation": 0,
   "color": "#9aa6ad"
  },
  {
   "id": "avenue-2",
   "x": 0,
   "y": 50,
   "width": 144,
   "height": 4,
   "surface": "street",
   "walkable": true,
   "elevation": 0,
   "color": "#2d363d"
  },
  {
   "id": "water-3a",
   "x": 49,
   "y": 68,
   "width": 34,
   "height": 24,
   "surface": "runoff-channel",
   "walkable": false,
   "elevation": 0,
   "color": "#3f6672"
  },
  {
   "id": "water-3l",
   "x": 49,
   "y": 92,
   "width": 7,
   "height": 4,
   "surface": "runoff-channel",
   "walkable": false,
   "elevation": 0,
   "color": "#3f6672"
  },
  {
   "id": "lane-4",
   "x": 48,
   "y": 71,
   "width": 36,
   "height": 2,
   "surface": "snow",
   "walkable": true,
   "elevation": 0,
   "color": "#b8c2c8"
  },
  {
   "id": "lane-5",
   "x": 48,
   "y": 80,
   "width": 36,
   "height": 2,
   "surface": "snow",
   "walkable": true,
   "elevation": 0,
   "color": "#b8c2c8"
  },
  {
   "id": "lane-6",
   "x": 48,
   "y": 89,
   "width": 36,
   "height": 2,
   "surface": "snow",
   "walkable": true,
   "elevation": 0,
   "color": "#b8c2c8"
  },
  {
   "id": "building-7",
   "x": 77,
   "y": 33,
   "width": 5,
   "height": 6,
   "surface": "utility-building",
   "walkable": false,
   "elevation": 2,
   "color": "#4b4f4c"
  },
  {
   "id": "building-8",
   "x": 63,
   "y": 57,
   "width": 4,
   "height": 6,
   "surface": "utility-building",
   "walkable": false,
   "elevation": 1,
   "color": "#3b4247"
  },
  {
   "id": "building-9",
   "x": 95,
   "y": 14,
   "width": 6,
   "height": 5,
   "surface": "utility-building",
   "walkable": false,
   "elevation": 2,
   "color": "#3b4247"
  },
  {
   "id": "building-10",
   "x": 117,
   "y": 19,
   "width": 7,
   "height": 6,
   "surface": "utility-building",
   "walkable": false,
   "elevation": 1,
   "color": "#4b4f4c"
  },
  {
   "id": "building-11",
   "x": 92,
   "y": 65,
   "width": 7,
   "height": 6,
   "surface": "utility-building",
   "walkable": false,
   "elevation": 1,
   "color": "#32393e"
  },
  {
   "id": "building-12",
   "x": 28,
   "y": 28,
   "width": 8,
   "height": 6,
   "surface": "utility-building",
   "walkable": false,
   "elevation": 1,
   "color": "#464d51"
  },
  {
   "id": "building-13",
   "x": 44,
   "y": 32,
   "width": 4,
   "height": 6,
   "surface": "utility-building",
   "walkable": false,
   "elevation": 1,
   "color": "#464d51"
  },
  {
   "id": "building-14",
   "x": 18,
   "y": 58,
   "width": 5,
   "height": 6,
   "surface": "utility-building",
   "walkable": false,
   "elevation": 1,
   "color": "#464d51"
  },
  {
   "id": "building-15",
   "x": 37,
   "y": 85,
   "width": 5,
   "height": 4,
   "surface": "utility-building",
   "walkable": false,
   "elevation": 1,
   "color": "#464d51"
  },
  {
   "id": "building-16",
   "x": 111,
   "y": 56,
   "width": 4,
   "height": 5,
   "surface": "utility-building",
   "walkable": false,
   "elevation": 2,
   "color": "#3b4247"
  },
  {
   "id": "building-17",
   "x": 19,
   "y": 31,
   "width": 7,
   "height": 6,
   "surface": "utility-building",
   "walkable": false,
   "elevation": 1,
   "color": "#4b4f4c"
  },
  {
   "id": "building-18",
   "x": 115,
   "y": 5,
   "width": 7,
   "height": 5,
   "surface": "utility-building",
   "walkable": false,
   "elevation": 2,
   "color": "#4b4f4c"
  },
  {
   "id": "building-19",
   "x": 78,
   "y": 9,
   "width": 7,
   "height": 4,
   "surface": "utility-building",
   "walkable": false,
   "elevation": 1,
   "color": "#3b4247"
  },
  {
   "id": "building-20",
   "x": 105,
   "y": 31,
   "width": 8,
   "height": 6,
   "surface": "utility-building",
   "walkable": false,
   "elevation": 1,
   "color": "#3b4247"
  },
  {
   "id": "building-21",
   "x": 56,
   "y": 16,
   "width": 8,
   "height": 6,
   "surface": "utility-building",
   "walkable": false,
   "elevation": 1,
   "color": "#4b4f4c"
  },
  {
   "id": "building-22",
   "x": 26,
   "y": 58,
   "width": 7,
   "height": 5,
   "surface": "utility-building",
   "walkable": false,
   "elevation": 1,
   "color": "#464d51"
  },
  {
   "id": "building-23",
   "x": 29,
   "y": 81,
   "width": 4,
   "height": 5,
   "surface": "utility-building",
   "walkable": false,
   "elevation": 1,
   "color": "#3b4247"
  },
  {
   "id": "building-24",
   "x": 62,
   "y": 36,
   "width": 5,
   "height": 5,
   "surface": "utility-building",
   "walkable": false,
   "elevation": 1,
   "color": "#4b4f4c"
  },
  {
   "id": "building-25",
   "x": 92,
   "y": 79,
   "width": 6,
   "height": 6,
   "surface": "utility-building",
   "walkable": false,
   "elevation": 2,
   "color": "#32393e"
  },
  {
   "id": "building-26",
   "x": 103,
   "y": 11,
   "width": 6,
   "height": 5,
   "surface": "utility-building",
   "walkable": false,
   "elevation": 1,
   "color": "#464d51"
  },
  {
   "id": "building-27",
   "x": 39,
   "y": 24,
   "width": 8,
   "height": 5,
   "surface": "utility-building",
   "walkable": false,
   "elevation": 1,
   "color": "#4b4f4c"
  },
  {
   "id": "building-28",
   "x": 39,
   "y": 15,
   "width": 4,
   "height": 5,
   "surface": "utility-building",
   "walkable": false,
   "elevation": 2,
   "color": "#32393e"
  },
  {
   "id": "building-29",
   "x": 97,
   "y": 41,
   "width": 4,
   "height": 6,
   "surface": "utility-building",
   "walkable": false,
   "elevation": 2,
   "color": "#3b4247"
  },
  {
   "id": "building-30",
   "x": 102,
   "y": 82,
   "width": 6,
   "height": 5,
   "surface": "utility-building",
   "walkable": false,
   "elevation": 1,
   "color": "#464d51"
  },
  {
   "id": "building-31",
   "x": 23,
   "y": 9,
   "width": 8,
   "height": 6,
   "surface": "utility-building",
   "walkable": false,
   "elevation": 1,
   "color": "#4b4f4c"
  },
  {
   "id": "building-32",
   "x": 56,
   "y": 5,
   "width": 6,
   "height": 5,
   "surface": "utility-building",
   "walkable": false,
   "elevation": 2,
   "color": "#3b4247"
  },
  {
   "id": "building-33",
   "x": 107,
   "y": 94,
   "width": 8,
   "height": 4,
   "surface": "utility-building",
   "walkable": false,
   "elevation": 1,
   "color": "#4b4f4c"
  },
  {
   "id": "building-34",
   "x": 36,
   "y": 72,
   "width": 4,
   "height": 6,
   "surface": "utility-building",
   "walkable": false,
   "elevation": 1,
   "color": "#3b4247"
  },
  {
   "id": "building-35",
   "x": 18,
   "y": 82,
   "width": 6,
   "height": 4,
   "surface": "utility-building",
   "walkable": false,
   "elevation": 2,
   "color": "#3b4247"
  },
  {
   "id": "building-36",
   "x": 37,
   "y": 66,
   "width": 5,
   "height": 4,
   "surface": "utility-building",
   "walkable": false,
   "elevation": 1,
   "color": "#4b4f4c"
  },
  {
   "id": "building-37",
   "x": 87,
   "y": 23,
   "width": 7,
   "height": 5,
   "surface": "utility-building",
   "walkable": false,
   "elevation": 2,
   "color": "#4b4f4c"
  },
  {
   "id": "building-38",
   "x": 118,
   "y": 58,
   "width": 5,
   "height": 4,
   "surface": "utility-building",
   "walkable": false,
   "elevation": 1,
   "color": "#32393e"
  },
  {
   "id": "building-39",
   "x": 78,
   "y": 58,
   "width": 8,
   "height": 6,
   "surface": "utility-building",
   "walkable": false,
   "elevation": 1,
   "color": "#3b4247"
  },
  {
   "id": "building-40",
   "x": 50,
   "y": 32,
   "width": 8,
   "height": 4,
   "surface": "utility-building",
   "walkable": false,
   "elevation": 1,
   "color": "#32393e"
  },
  {
   "id": "building-41",
   "x": 20,
   "y": 17,
   "width": 5,
   "height": 5,
   "surface": "utility-building",
   "walkable": false,
   "elevation": 2,
   "color": "#4b4f4c"
  },
  {
   "id": "building-42",
   "x": 100,
   "y": 59,
   "width": 8,
   "height": 4,
   "surface": "utility-building",
   "walkable": false,
   "elevation": 1,
   "color": "#464d51"
  },
  {
   "id": "building-43",
   "x": 96,
   "y": 95,
   "width": 8,
   "height": 4,
   "surface": "utility-building",
   "walkable": false,
   "elevation": 1,
   "color": "#3b4247"
  },
  {
   "id": "building-44",
   "x": 89,
   "y": 4,
   "width": 6,
   "height": 6,
   "surface": "utility-building",
   "walkable": false,
   "elevation": 1,
   "color": "#464d51"
  },
  {
   "id": "building-45",
   "x": 97,
   "y": 89,
   "width": 8,
   "height": 4,
   "surface": "utility-building",
   "walkable": false,
   "elevation": 2,
   "color": "#464d51"
  },
  {
   "id": "building-46",
   "x": 40,
   "y": 42,
   "width": 7,
   "height": 5,
   "surface": "utility-building",
   "walkable": false,
   "elevation": 1,
   "color": "#4b4f4c"
  },
  {
   "id": "building-47",
   "x": 81,
   "y": 25,
   "width": 4,
   "height": 6,
   "surface": "utility-building",
   "walkable": false,
   "elevation": 1,
   "color": "#32393e"
  },
  {
   "id": "building-48",
   "x": 43,
   "y": 6,
   "width": 6,
   "height": 6,
   "surface": "utility-building",
   "walkable": false,
   "elevation": 1,
   "color": "#4b4f4c"
  },
  {
   "id": "building-49",
   "x": 103,
   "y": 65,
   "width": 6,
   "height": 4,
   "surface": "utility-building",
   "walkable": false,
   "elevation": 1,
   "color": "#3b4247"
  },
  {
   "id": "building-50",
   "x": 117,
   "y": 70,
   "width": 6,
   "height": 4,
   "surface": "utility-building",
   "walkable": false,
   "elevation": 1,
   "color": "#3b4247"
  },
  {